clause_number,clause_name,clause_description,extraction_inclusion_criteria,extraction_exclusion_criteria
043,Commission and Sales Compensation,"Commission structures, draws, quotas, territory assignments, and house accounts. ESA requirements for commission during vacation and leaves. Clarification of commission entitlement during notice period following Paquette v. TeraGo Networks Inc. and Lin v. Ontario Teachers' Pension Plan Board, 2016 ONCA 619. Territory changes and account reassignments.","Must include: commission rates and tiers, quota setting process, territory definitions, account assignments, house account rules, split commission rules, draw against commission, true-up procedures, commission payment timing, charge-back provisions, customer payment requirements, commission during notice, vacation pay on commission, leave impact on commission, accelerators and decelerators, spiffs and bonuses, override commissions, trail commissions","Must exclude: base salary, general bonuses, stock options, benefits, expense reimbursements, car allowances"
044,Temporary Layoff Provisions,"Rights to temporarily layoff under ESA s.56 (13 weeks in 20-week period or 35 weeks in 52-week period with benefits/payments). Common law position that layoff without contractual right constitutes constructive dismissal (Elsegood v. Cambridge Spring Service, 2011 ONCA 831). Recall rights and procedures. Benefits during layoff. Deemed termination triggers.","Must include: temporary layoff authorization, ESA timing limits, benefit continuation during layoff, supplementary unemployment benefits, recall procedures and notice, seniority during layoff, bumping rights, refusal of recall consequences, deemed termination dates, severance triggering events, communication during layoff, alternative work during layoff, partial layoffs, rotating layoffs, emergency layoffs, infectious disease emergency layoffs, vacation during layoff","Must exclude: termination without cause, resignation, permanent workforce reductions, plant closures, strikes and lockouts"
045,Modification and Amendment,"Procedures for changing employment terms. Consideration requirements for post-employment amendments following Hobbs v. TDI Canada Ltd., 2004 CanLII 44783 ON CA. Written modification requirements. Implied term changes through conduct. Policy manual amendments. Grandfathering provisions. Notice of changes. Acceptance mechanisms.","Must include: written amendment requirements, consideration for changes, mutual agreement provisions, policy manual updates, grandfathering clauses, notice of changes procedures, deemed acceptance provisions, protest and work under protest, fundamental term changes, compensation adjustments, benefit plan changes, regulatory-driven amendments, technology updates, business transfer impacts, change management procedures, dispute resolution for changes","Must exclude: automatic adjustments, cost of living increases, collective agreement modifications, termination terms, merger and acquisition"
046,Dispute Resolution and Arbitration,"Mandatory arbitration clauses, mediation requirements, and litigation alternatives. Arbitration acts (provincial and federal) application. Carve-outs for ESA claims and human rights complaints which cannot be contracted out. Cost allocation. Appeal rights. Expedited procedures. Choice of arbitrators. Governing law and jurisdiction.","Must include: negotiation requirements first, mediation procedures, arbitrator selection process, arbitration rules applicable, cost and fee allocation, location of proceedings, expedited procedures, appeal limitations, confidentiality of proceedings, interim relief availability, ESA and human rights carve-outs, class action waivers, jury trial waivers, limitation periods, governing law selection, jurisdiction agreements, service of process","Must exclude: grievance procedures (union), internal complaint processes, performance review appeals, workplace investigations"
047,Entire Agreement and Integration,"Supersession of prior agreements, representations, and understandings. Integration clause preventing reliance on oral promises or outside documents. Parol evidence rule application. Survival of certain provisions. Incorporation by reference. Employee acknowledgments. Impact on prior employment agreements or offer letters.","Must include: supersession of prior agreements, oral representation exclusions, integration of all terms, specific document incorporations, survival clause specifications, offer letter supersession, policy manual relationships, benefit plan documents, stock option agreements, confidentiality agreement continuity, reliance exclusions, inducement representations, acknowledgment of understanding, independent legal advice, translation provisions, execution formalities","Must exclude: future modifications, amendment procedures, collective agreements, statutory entitlements, common law implications"
048,Waiver and Estoppel,"Non-waiver provisions, written waiver requirements, and estoppel limitations. Single instance waivers not constituting ongoing waiver. Reservation of rights. Failure to enforce not constituting abandonment. Time limitations on claims. Doctrines of acquiescence and laches. Promissory estoppel limitations per employment context.","Must include: written waiver requirements, single vs. continuing waivers, non-enforcement impacts, reservation of rights, partial enforcement rights, delay in enforcement, acquiescence limitations, consent requirements, precedent disclaimers, policy exception handling, accommodation without precedent, past practice limitations, custom and usage exclusions, promissory estoppel limits, detrimental reliance issues","Must exclude: specific term modifications, amendment procedures, settlement agreements, releases and indemnities"
049,Notice and Communication","Methods of formal notice delivery between parties. Electronic communication validity. Deemed receipt provisions. Address for service. Email and portal notifications. Emergency contact information. Beneficiary designations. Change of address obligations. Service requirements for legal proceedings.","Must include: acceptable delivery methods, physical mail requirements, email notification validity, employee portal use, deemed receipt timing, address for service, emergency contact updates, beneficiary designations, change notification obligations, out-of-office impacts, alternative contact methods, legal service provisions, union notice requirements, government notice obligations, public filing requirements, language of communications","Must exclude: resignation notice periods, termination notice requirements, investigation notices, policy update distributions"
050,Governing Law and Jurisdiction,"Choice of law provisions, forum selection, and conflict of laws. Application of Ontario Employment Standards Act regardless of choice of law for Ontario employees. Federal vs. provincial jurisdiction for regulated industries. Foreign employee considerations. Cross-border employment issues. Mandatory forum provisions limitations.","Must include: Ontario law application, federal vs provincial jurisdiction, forum selection clauses, exclusive vs non-exclusive jurisdiction, conflict of law rules, mandatory law application, ESA territorial scope, foreign law exclusions, cross-border considerations, regulatory jurisdiction, venue selection, service outside jurisdiction, forum non conveniens, parallel proceedings, enforcement of judgments, choice of law limitations","Must exclude: arbitration agreements, dispute resolution procedures, entire agreement clauses, notice provisions"