clause_number,clause_name,clause_description,extraction_inclusion_criteria,extraction_exclusion_criteria
001,Position and Title,"Defines the employee's job title, position, classification, and role within the organization. This clause establishes the employee's place in the corporate structure and may impact entitlements under the Employment Standards Act, 2000 (ESA) regarding overtime exemptions for managers/supervisors under O. Reg. 285/01. Critical for determining whether employee falls under managerial exemptions and for establishing the fundamental nature of the employment relationship as per common law principles.","Must include: specific job title, position name, department/division placement, employee classification (full-time/part-time/temporary/permanent), reference to job grade or level, management/supervisory designation if applicable, exempt/non-exempt status under ESA, any dual role arrangements, acting or interim position designations, reference to National Occupational Classification (NOC) codes if applicable","Must exclude: detailed job duties or responsibilities, performance expectations, reporting relationships, compensation tied to position, work location, hours of work, probationary status, employment type beyond classification, career progression or promotion paths"
002,Duties and Responsibilities,"Comprehensive description of job functions, tasks, and obligations the employee must perform. Essential for establishing the employment contract's fundamental terms and potential constructive dismissal claims under common law if substantially changed (Farber v. Royal Trust Co., 1997 CanLII 387 SCC). Must be read in conjunction with Ontario Human Rights Code requirements for accommodation to the point of undue hardship and AODA standards for accessible employment.","Must include: primary job functions and essential duties, specific tasks and deliverables, scope of authority and decision-making power, budget or financial responsibilities, safety responsibilities under Occupational Health and Safety Act, quality standards and service levels, regulatory compliance obligations, fiduciary duties if applicable, duty of good faith and fidelity per common law, confidentiality obligations during employment, travel requirements as part of duties, on-call or emergency response duties, cross-functional responsibilities","Must exclude: job title alone without duties, reporting structure, performance metrics or KPIs, training requirements, tools or equipment provided, work location, compensation for duties performed, hours of work, professional development expectations"
003,Reporting Structure,"Establishes organizational hierarchy, direct reporting relationships, and supervision responsibilities. Important for vicarious liability under common law, determining managerial exemptions under ESA O. Reg. 285/01, and establishing authority for Occupational Health and Safety Act obligations. May impact constructive dismissal claims if reporting structure changes substantially diminish employee's position (Farquhar v. Butler Brothers Supplies Ltd., 1988 CanLII 185 BCCA).","Must include: direct supervisor/manager identification by title or name, dotted-line reporting relationships, matrix reporting structures, number and types of direct reports, supervisory responsibilities and authority levels, participation in management committees, board reporting if applicable, delegation of authority provisions, temporary reporting during absences, cross-functional team leadership, project-based reporting structures, changes to reporting structure procedures","Must exclude: general collaboration requirements, job duties unrelated to supervision, performance review process, compensation for supervisory duties, team membership without reporting implications, customer or external relationships, professional development reporting, committee participation without authority"
004,Base Salary/Wages,"Fixed compensation amount establishing the employment contract's consideration and ensuring compliance with ESA minimum wage requirements (currently $17.20/hour as of 2024) and pay equity obligations under Pay Equity Act for applicable employers. Must comply with payment provisions under ESA s.11 regarding regular pay periods and statements. Forms basis for calculating vacation pay (minimum 4% under ESA s.35), public holiday pay, and severance entitlements.","Must include: annual salary or hourly wage rate, payment frequency (weekly/bi-weekly/semi-monthly/monthly per ESA s.11), currency of payment, base salary exclusive of other compensation, minimum wage compliance confirmation, pay equity considerations if applicable, salary grade or band references, geographic pay differentials, shift premiums under ESA, weekend or evening differentials, guaranteed minimum earnings, draw against commission if applicable, salary during notice period provisions","Must exclude: bonuses or incentive compensation, commission structures, overtime payments, benefits value, stock options or equity, perquisites or allowances, expense reimbursements, profit sharing, severance pay calculations, vacation pay (though calculated from base), holiday pay premiums, retroactive pay adjustments"
005,Variable Compensation/Bonuses,"Performance-based compensation including bonuses, incentives, commissions, and profit-sharing arrangements. Must comply with ESA requirements that bonuses may be included in calculating minimum wage (s.5(1)) and vacation pay (s.35.2). Common law principles from cases like Paquette v. TeraGo Networks Inc., 2016 ONCA 618 establish that bonus entitlements during notice period depend on contract language regarding 'active employment'.","Must include: bonus structure and calculation methodology, performance metrics and targets (personal/team/company), commission rates and structures, profit-sharing formulas, sales incentive plans, eligibility requirements and qualifying periods, payment timing and frequency, discretionary vs. non-discretionary designation, clawback provisions, bonus entitlement during leaves or notice period, accelerators and decelerators, territory or account assignments for commission, revenue recognition policies, bonus pool determinations","Must exclude: base salary or wages, standard benefits, pension contributions, stock options (unless cash-settled), perquisites, expense reimbursements, severance pay, overtime pay, shift premiums, retention bonuses (separate clause), signing bonuses (separate clause)"
006,Benefits Package,"Health and welfare benefits including extended health, dental, vision, life insurance, and disability coverage. Must comply with ESA continuation during statutory leaves (s.51) and Ontario Human Rights Code requirements for equal treatment. Insurance Act and federal/provincial regulations govern group benefit plans. Benefits continuation during notice period is presumed under common law unless explicitly excluded (Taggart v. Canada Life Assurance Co., 2006 CanLII 53345 ON CA).","Must include: extended health care coverage details and employee contributions, dental care coverage and annual maximums, vision care benefits and frequency, life insurance (basic and optional) and AD&D coverage, short-term disability terms and elimination periods, long-term disability coverage and benefit percentages, Employee Assistance Programs (EAP), wellness programs and health spending accounts, paramedical services coverage, prescription drug formulary tiers, out-of-country emergency medical, dependent coverage and definitions, coverage during leaves of absence, benefits continuation during notice period, waiting periods for new employees, evidence of insurability requirements","Must exclude: pension or retirement savings, vacation entitlements, statutory leaves, workers' compensation (WSIB), employment insurance (EI), Canada Pension Plan (CPP), stock options, perquisites, professional development funding, parking or transportation benefits"
007,Pension and Retirement Plans,"Retirement savings including defined benefit/contribution pension plans, RRSPs, DPSPs, and TFSAs. Governed by Pension Benefits Act (Ontario), Income Tax Act (federal), and must comply with ESA requirements for benefit continuation during leaves. Pension Benefits Guarantee Fund provides protection for defined benefit plans. Common law recognizes pension as deferred compensation requiring reasonable notice for changes (Schmidt v. AMEC Earth & Environmental, 2004 ABQB 509).","Must include: registered pension plan details (defined benefit/contribution/hybrid), employer contribution amounts or formulas, employee contribution requirements (mandatory/optional), RRSP matching programs and limits, Deferred Profit Sharing Plans (DPSP), Tax-Free Savings Account (TFSA) programs, vesting schedules and cliff/graded vesting, portability and transfer options, early retirement provisions and bridges, normal retirement date definitions, pension adjustment calculations, past service buyback options, survivor benefits, pension continuation during leaves, compliance with Pension Benefits Act standards","Must exclude: general benefits package, severance pay arrangements, stock options or equity plans, performance bonuses, health and welfare benefits, insurance products, non-registered savings plans, financial planning services, retirement transition programs without pension component"
008,Stock Options and Equity,"Equity compensation including stock options, restricted stock units (RSUs), performance share units (PSUs), employee share purchase plans (ESPPs), and phantom stock. Governed by Income Tax Act provisions for employee stock options, securities legislation, and TSX/corporate governance requirements. Common law treatment during notice period established in cases like Veer v. Dover Corporation (Canada), 1999 CanLII 3008 ON CA, requiring clear exclusion language.","Must include: stock option grants and exercise prices, vesting schedules and acceleration triggers, RSU/PSU grant terms and performance metrics, ESPP contribution limits and discounts, exercise periods and blackout restrictions, change of control provisions (single/double trigger), tax withholding and Section 7 ITA implications, transferability restrictions, clawback and forfeiture conditions, good leaver/bad leaver provisions, underwater option treatment, dividend equivalent rights, option repricing policies, securities law compliance requirements, insider trading policy application","Must exclude: cash bonuses or profit sharing, pension or retirement plans, base salary, standard benefits, perquisites, deferred compensation (non-equity), retention bonuses (unless equity-based), transaction bonuses, founder shares or sweat equity"
009,Perquisites and Allowances,"Executive perquisites and special allowances beyond standard compensation and benefits. Canada Revenue Agency (CRA) treats many perquisites as taxable benefits under Income Tax Act s.6. Must be reasonable and connected to business purpose to avoid shareholder benefit implications. Common law recognizes perquisites as part of compensation package for wrongful dismissal calculations (Piresferreira v. Ayotte, 2010 ONCA 384).","Must include: vehicle allowance or company car provisions, parking space allocation and costs, club memberships (business/social/fitness), mobile phone and technology allowances, home office stipends and equipment, executive physical examinations, financial planning services, tax preparation assistance, professional association dues, publication subscriptions, executive dining privileges, first/business class travel policies, spousal travel provisions, accommodation allowances, clothing or uniform allowances, personal security services, Directors & Officers insurance","Must exclude: base salary, standard employee benefits, performance bonuses, stock options, pension contributions, business expense reimbursements, relocation expenses, professional development costs, standard technology for job performance, mandatory safety equipment"
010,Work Location,"Primary place of work, remote work arrangements, and geographic assignment. Significant changes may constitute constructive dismissal under common law (Farquhar v. Butler Brothers). Must comply with Occupational Health and Safety Act requirements for workplace safety regardless of location. ESA applies to Ontario-based employees regardless of where work is performed. Cross-border employment raises Income Tax Act and workers' compensation issues.","Must include: primary office or facility address, remote work eligibility and requirements, hybrid work schedules and in-office requirements, home office designation and safety requirements, multi-site work arrangements, field work territories, client site assignments, international assignment possibilities, work from anywhere policies and restrictions, co-working space provisions, hot-desking or hoteling arrangements, satellite office access, jurisdiction for employment law purposes, tax point of employment, workers' compensation coverage location, choice of law provisions","Must exclude: business travel requirements, commute time or compensation, relocation terms, training locations, conference attendance, temporary assignments, overtime work location, emergency response locations, parking arrangements at work location"
011,Work Hours and Schedule,"Standard working hours, scheduling, and overtime eligibility under ESA. Must comply with hours of work limits (ESA s.17 - maximum 8 hours/day, 48 hours/week unless written agreement), overtime pay requirements (ESA s.22 - 1.5x after 44 hours), and rest period provisions. Averaging agreements permitted under ESA s.22(2). Exempt employees under O. Reg. 285/01 must be clearly identified.","Must include: standard daily and weekly hours, core hours for flexible schedules, shift patterns and rotations, overtime eligibility and ESA exemptions, compressed work week arrangements, averaging agreements under ESA, on-call and standby requirements, break and meal period entitlements (ESA s.20), rest periods between shifts (ESA s.18), Sunday work provisions, split shift arrangements, seasonal hour variations, maximum hour agreements, time tracking requirements, flex-time policies, banked time or lieu time provisions, partial day absences treatment","Must exclude: vacation entitlements, statutory holiday schedules, sick leave provisions, personal emergency leave, work location, compensation rates, performance expectations during hours, professional development time, travel time compensation"
012,Vacation and Time Off,"Annual vacation entitlements exceeding or meeting ESA minimums (2 weeks after 1 year, 3 weeks after 5 years under s.33). Vacation pay minimum 4% (6% after 5 years) under ESA s.35. Vacation scheduling subject to employer approval under ESA s.35.2. Use-it-or-lose-it policies must comply with ESA prohibition on contracting out (s.5). Vacation during notice period addressed in Love v. Acuity Investment Management Inc., 2011 ONCA 130.","Must include: annual vacation day entitlements, vacation accrual rates and methods, vacation pay percentage calculations, scheduling procedures and blackout periods, carryover provisions and limits, vacation payout on termination, prorated entitlements for partial years, vacation during notice period rights, sabbatical or extended leave options, minimum continuous vacation requirements, vacation banking or purchase programs, statutory vs. contractual entitlements, seniority-based increases, vacation for part-time employees, treatment during leaves of absence, advance vacation policies","Must exclude: sick leave or personal days, statutory holidays, parental or pregnancy leave, bereavement leave, jury duty, professional development time, compensatory time off, unpaid leaves, short/long-term disability"
013,Sick Leave and Personal Days,"Paid and unpaid sick leave beyond ESA minimum sick leave entitlements (3 unpaid days under s.50). Interfaces with short-term disability benefits and WSIB coverage for work-related illness/injury. Must comply with Ontario Human Rights Code duty to accommodate disabilities. Privacy obligations under PIPEDA for medical information. Attendance management programs must avoid discrimination per Ontario Human Rights Commission Policy on Ableism.","Must include: paid sick days allocation and accrual, personal emergency leave entitlements, medical documentation requirements, reporting procedures for absences, integration with STD benefits, attendance management programs, return to work processes, accommodation procedures, partial day absence treatment, chronic illness provisions, medical leave of absence terms, quarantine or isolation pay, mental health days, family emergency leave, compassionate care leave provisions, sick leave payout or carryover, probationary period restrictions","Must exclude: vacation entitlements, statutory holidays, pregnancy/parental leave, workplace injury (WSIB), long-term disability, bereavement leave, jury duty leave, unpaid leaves of absence, professional development, sabbaticals"
014,Statutory Holidays and Leaves,"Public holidays under ESA (9 public holidays) and statutory leaves including pregnancy (17 weeks), parental (61/63 weeks), family responsibility, bereavement, and others under Part XIV of ESA. Must maintain benefits during leaves per ESA s.51 and ensure reinstatement rights under s.53. Federal employees covered by Canada Labour Code with different entitlements. Cannot contract out of minimums per ESA s.5.","Must include: public holiday entitlements and pay calculation (ESA formula), additional holidays beyond statutory minimums, pregnancy leave and maternity benefits top-up, parental leave (birth/non-birth parent distinctions), family caregiver leave (multiple types under ESA), family medical leave, critical illness leave, crime-related death/disappearance leave, domestic/sexual violence leave, organ donor leave, reservist leave, declared emergency leave, infectious disease emergency leave, bereavement leave entitlements, jury duty provisions, voting leave requirements","Must exclude: vacation entitlements, sick leave or personal days, professional development leave, sabbaticals, unpaid personal leaves, workers' compensation leave, short/long-term disability, administrative leave, garden leave"
015,Probationary Period,"Trial period for new employees, though ESA protections apply from day one except for notice/severance after less than 3 months (s.54). Cannot contract out of minimum standards during probation. Performance issues during probation still require documentation for just cause termination. Ontario Human Rights Code protections apply immediately. Common law recognizes shorter notice during early employment (Love v. Acuity Investment Management Inc., 2011 ONCA 130).","Must include: probation period length (typically 3-6 months), performance expectations and review schedule, extension provisions and criteria, benefits eligibility during probation, termination provisions during probation, notice entitlements if applicable, conversion to permanent status procedures, feedback and coaching requirements, probationary review documentation, accommodation requirements during probation, second probation for role changes, working notice during probation, severance exclusions under 3 months, appeal or grievance rights","Must exclude: ongoing performance management, annual reviews post-probation, progressive discipline procedures, long-term incentive eligibility, promotion assessments, training periods distinct from probation, independent contractor trial periods"
016,Performance Management,"Ongoing performance evaluation, improvement plans, and progressive discipline. Must comply with procedural fairness requirements for unionized employees and common law reasonable notice for performance issues. Performance improvement plans (PIPs) should specify consequences while avoiding constructive dismissal. Documentation critical for just cause termination per McKinley v. BC Tel, 2001 SCC 38 proportionality test.","Must include: performance review cycles and timelines, performance metrics and KPIs, rating scales and calibration processes, goal setting and objective frameworks, performance improvement plans (PIP) procedures, progressive discipline steps and documentation, coaching and feedback requirements, 360-degree review processes, self-assessment components, performance-based compensation links, competency assessments, performance appeals processes, underperformance consequences, exceeds expectations recognition, performance during notice obligations, accommodation for performance issues","Must exclude: probationary assessments only, recruitment assessments, promotion criteria, training requirements, professional development planning, succession planning, termination procedures, compensation reviews separate from performance"
017,Professional Development,"Training, education, and career development opportunities. May include mandatory training under Occupational Health and Safety Act, AODA customer service standards, or professional licensing requirements. Tuition reimbursement may require repayment agreements enforceable within reasonable limits. Professional development during notice period may be limited per common law unless contractually guaranteed.","Must include: mandatory training requirements and schedules, optional professional development opportunities, tuition reimbursement programs and limits, professional certification support, conference and seminar attendance, continuing education requirements, leadership development programs, mentorship and coaching programs, cross-training opportunities, secondment possibilities, study leave provisions, repayment agreements for training costs, professional membership dues, licensing and certification fees, online learning platforms access, career planning resources, succession planning participation","Must exclude: performance improvement plans, probationary training, basic job orientation, safety training (separate clause), product or service training, systems training, performance reviews, compensation for development time"
018,Termination Without Cause,"Employer's right to terminate without cause with notice or pay in lieu. Must meet ESA minimums for notice (1-8 weeks), severance pay (if applicable), and benefit continuation. Common law reasonable notice typically exceeds ESA based on Bardal factors (age, length of service, position, availability of similar employment). Limiting clauses must be clear and unambiguous per Machtinger v. HOJ Industries Ltd., 1992 CanLII 102 SCC.","Must include: notice periods or formula (ESA minimum vs. common law), pay in lieu of notice provisions, benefit continuation during notice, severance pay calculations if applicable (ESA s.64), working notice vs. pay in lieu options, resignation during notice period terms, mitigation obligations and impact, reference letter provisions, outplacement services, release requirements and consideration, post-employment restrictions during notice, treatment of bonuses/commissions during notice, equity vesting acceleration, garden leave provisions, payment timing and structure, tax optimization provisions","Must exclude: just cause termination, resignation by employee, retirement provisions, frustration of contract, fixed-term contract expiry, constructive dismissal, progressive discipline, performance management, layoff provisions"
019,Termination With Cause,"Termination for just cause eliminating notice/severance obligations. Must meet high threshold established in McKinley v. BC Tel - misconduct must be proportional to dismissal. ESA s.55 provides for termination for 'wilful misconduct' but common law standard typically higher. Progressive discipline usually required unless serious misconduct. Summary dismissal must be justified by egregious conduct.","Must include: just cause definitions and examples, wilful misconduct standards under ESA, dishonesty and theft provisions, violence and harassment grounds, insubordination and insolence, conflict of interest violations, breach of confidentiality, criminal charges or convictions impact, incompetence despite warnings, intoxication and substance abuse, abandonment of position, breach of fiduciary duty, progressive discipline requirements, investigation procedures, opportunity to respond rights, summary dismissal circumstances, after-acquired cause provisions","Must exclude: without cause termination, resignation, retirement, frustration of contract, layoff or recall, performance management separate from cause, probationary termination, fixed-term expiry"
020,Resignation Requirements,"Employee's obligation to provide notice when resigning. ESA requires reasonable notice from employees though less commonly enforced than employer obligations. Common law may require longer notice for senior employees or specialized positions causing damages to employer (Consbec Inc. v. Walker, 2016 ONCA 970). Garden leave or restrictions may apply during resignation notice.","Must include: resignation notice periods required, written resignation requirements, irrevocability of resignation, employer's right to pay in lieu, working notice expectations, transition responsibilities, knowledge transfer obligations, project completion requirements, client notification procedures, return of property during notice, garden leave during resignation, compensation during notice period, benefit termination timing, vacation payout calculations, bonus eligibility cutoffs, equity forfeiture provisions, counter-offer procedures, retirement notice distinctions","Must exclude: termination by employer, constructive dismissal claims, job abandonment, frustration of contract, death or disability, fixed-term completion, mutual agreement to separate"
